IMPEGNO_ID	TIPO_MOVIMENTO	ANNO_ESERCIZIO	ANNO_IMPEGNO	NUMERO_IMPEGNO	NUMERO_SUBIMPEGNO	PLURIENNALE	CAPO_RIACC	NUMERO_CAPITOLO	NUMERO_ARTICOLO	NUMERO_UEB	DATA_EMISSIONE	DATA_SCADENZA	STATO_OPERATIVO	IMPORTO_INIZIALE	IMPORTO_ATTUALE	DESCRIZIONE	ANNO_CAPITOLO_ORIG	NUMERO_CAPITOLO_ORIG	NUMERO_ARTICOLO_ORIG	NUMERO_UEB_ORIG	ANNO_PROVVEDIMENTO	NUMERO_PROVVEDIMENTO	TIPO_PROVVEDIMENTO	SAC_PROVVEDIMENTO	OGGETTO_PROVVEDIMENTO	NOTE_PROVVEDIMENTO	STATO_PROVVEDIMENTO	SOGGETTO_DETERMINATO	CODICE_SOGGETTO	CLASSE_SOGGETTO	NOTA	CUP	CIG	TIPO_IMPEGNO	ANNO_IMPEGNO_PLUR	NUMERO_IMPEGNO_PLUR	ANNO_IMPEGNO_RIACC	NUMERO_IMPEGNO_RIACC	OPERA	COD_INTERV_CLASS	PDC_FINANZIARIO	MISSIONE	PROGRAMMA	COFOG	TRANSAZIONE_UE_SPESA	SIOPE_SPESA	SPESA_RICORRENTE	PERIMETRO_SANITARIO_SPESA	POLITICHE_REGIONALI_UNITARIE	PDC_ECONOMICO_PATR	CLASSIFICATORE_1	CLASSIFICATORE_2	CLASSIFICATORE_3	CLASSIFICATORE_4	CLASSIFICATORE_5	ENTE_PROPRIETARIO_ID	PARERE_FINANZIARIO
91	I	2016	2016	697	0	N	N	1901002	0	1	2016-01-01		N	1033,64	1033,64	vers. contr. cpdel e inadel p anno 2015 - CONTO CONSUNTIVO 2015 RO 2016	2016	0	0	1	2016	9999	DD||K				D	N	0					SVI			2015	274			U.1.01.02.01.000	4	6		4	1111	1									30	1
92	I	2016	2016	698	0	N	N	8508000	0	1	2016-01-01		N	19,25	19,25	LAVORI DI PRONTO INTERVENTO DELLA SEGNALETICA STRADALE ORIZZONTALE E VERTICALE - CONTO CONSUNTIVO 2015 IR-RO 2016	2016	0	0	1	2016	9999	DD||K				D	N	0					SVI			2015	964			U.2.02.01.09.000	10	5		4	2116	1									30	1
93	I	2016	2016	699	0	N	N	550004	0	1	2016-01-01		N	1718,01	1718,01	vers. irap anno 2015 - CONTO CONSUNTIVO 2015 RO 2016	2016	0	0	1	2016	9999	DD||K				D	N	0					SVI			2015	292			U.1.02.01.01.000	1	6		4	1701	1									30	1
94	I	2016	2016	700	0	N	N	3200002	0	1	2016-01-01		N	4292,55	4292,55	vers. contr. cpdel e inadel p anno 2015 - CONTO CONSUNTIVO 2015 RO 2016	2016	0	0	1	2016	9999	DD||K				D	N	0					SVI			2015	281			U.1.01.02.01.000	12	1		4	1111	1									30	1
95	I	2016	2016	701	0	N	N	102001	0	1	2016-01-01		N	760	760	RETRIBUZIONE AL PERSONALE SERVIZIO COMUNICAZIONE PUBBLICA E SERVIZIO PREVENZIONE E PROTEZIONE: ASSEGNI FISSI ED INDENNITA' - CONTO CONSUNTIVO 2015 RO 2016	2016	0	0	1	2016	9999	DD||K				D	N	0					SVI			2015	217			U.1.01.01.01.000	1	11		4	1101	1									30	1
96	I	2016	2016	702	0	N	N	3886000	0	1	2016-01-01		N	44743,76	44743,76	SOSTEGNO ALLA RETE DEI SERVIZI PER LA PRIMA INFANZIA  - CONTO CONSUNTIVO 2015 IR-RO 2016	2016	0	0	1	2016	9999	DD||K				D	N	0					SVI			2015	1454			U.1.04.03.99.000	12	1		4	1583	1									30	1
97	I	2016	2016	703	0	N	N	5851002	0	1	2016-01-01		N	107175,15	107175,15	ADEG.TO NORME ANTINCENDIO SCUOLA MATERNA CONCORDIA  - CONTO CONSUNTIVO 2015 IR-RO 2016	2016	0	0	1	2016	9999	DD||K				D	N	0					SVI			2015	759			U.2.02.01.09.000	4	1		4	2109	1									30	1
98	I	2016	2016	704	0	N	N	7961003	0	1	2016-01-01		N	3000	3000	INTERVENTI DI CONSOLIDAMENTO C/O SCUOLE MATERNE - MUTUO - CONTO CONSUNTIVO 2015 IR-RO 2016-MUTUO	2016	0	0	1	2016	9999	DD||K				D	N	0					SVI			2015	742			U.2.02.01.09.000	4	1		4	2109	1									30	1
99	I	2016	2016	705	0	N	N	7988002	0	1	2016-01-01		N	148000	148000	PROGETTO INTEGRATO DI SVILUPPO URBANO DELLA CITTA' DI VC - PARTE - CONTO CONSUNTIVO 2015 IR-RO 2016	2016	0	0	1	2016	9999	DD||K				D	N	0					SVI			2015	1270			U.2.02.01.10.000	8	1		3	2799	1									30	1
100	I	2016	2016	706	0	N	N	8059002	0	1	2016-01-01		N	2200	2200	LAVORI DI ADEGUAMENTO NORME CENTRALI TERMICHE EDIFICI SCOLASTICI SCUOLE INFANZIA T.MORA E G.FERRARI - CONTO CONSUNTIVO 2015 IR-RO 2016	2016	0	0	1	2016	9999	DD||K				D	N	0			E66E08000220004	1801066EAA	SVI			2015	694			U.2.02.01.09.000	4	2		4	2113	1									30	1
101	I	2016	2016	707	0	N	N	8068000	0	1	2016-01-01		N	12321,05	12321,05	BONIFICA EX AREA MONTECATINI -  - CONTO CONSUNTIVO 2015 IR-RO 2016	2016	0	0	1	2016	9999	DD||K				D	N	0					SVI			2015	1273			U.2.02.02.01.000	9	5		4	2107	1									30	1
102	I	2016	2016	708	0	N	N	5851002	0	1	2016-01-01		N	500	500	ADEG.TO NORME ANTINCENDIO SCUOLA MATERNA CONCORDIA   - CONTO CONSUNTIVO 2015 IR-RO 2016	2016	0	0	1	2016	9999	DD||K				D	N	0					SVI			2015	757			U.2.02.01.09.000	4	1		4	2109	1									30	1
103	I	2016	2016	709	0	N	N	7294002	0	1	2016-01-01		N	1563,62	1563,62	CITTADELLA GIUDIZIARIA - PARTE SPESA  - CONTO CONSUNTIVO 2015 IR-RO 2016	2016	0	0	1	2016	9999	DD||K				D	N	0					SVI			2015	1012			U.2.02.01.09.000	1	5		4	2109	1									30	1
104	I	2016	2016	710	0	N	N	7984001	0	1	2016-01-01		N	1184,59	1184,59	ACQUISTO TENSOSTRUTTURE PER IMPIANTI SPORTIVI  - CONTO CONSUNTIVO 2015 IR-RO 2016	2016	0	0	1	2016	9999	DD||K				D	N	0					SVI			2015	1240			U.2.02.01.04.000	6	1		4	2502	1									30	1
105	I	2016	2016	711	0	N	N	8508000	0	1	2016-01-01		N	5707,69	5707,69	INTERVENTI DI MANUTENZ. E MODIFICA SEGNALETICA  - CONTO CONSUNTIVO 2015 IR-RO 2016	2016	0	0	1	2016	9999	DD||K				D	N	0					SVI			2015	953			U.2.02.01.09.000	10	5		4	2102	1									30	1
106	I	2016	2016	712	0	N	N	4200002	0	1	2016-01-01		N	899,67	899,67	vers. contr. cpdel e inadel p anno 2015 - CONTO CONSUNTIVO 2015 RO 2016	2016	0	0	1	2016	9999	DD||K				D	N	0					SVI			2015	278			U.1.01.02.01.000	10	5		4	1111	1									30	1
107	I	2016	2016	713	0	N	N	3894000	0	1	2016-01-01		N	244000	244000	CANONE ADDIZIONALE L. 222/07 - CONTO CONSUNTIVO 2015 RO 2016	2016	0	0	1	2016	9999	DD||K				D	N	0					SVI			2015	1946			U.1.04.02.05.000	12	5		8	1581	1									30	1
108	I	2016	2016	714	0	N	N	8508000	0	1	2016-01-01		N	100	100	LAVORI DI PRONTI INTERVENTI DELLA SEGNALETICA STRADALE ORIZZONTALE E VERTICALE - CONTO CONSUNTIVO 2015 IR-RO 2016	2016	0	0	1	2016	9999	DD||K				D	N	0					SVI			2015	956			U.2.02.01.09.000	10	5		4	2102	1									30	1
109	I	2016	2016	715	0	N	N	2210003	0	1	2016-01-01		N	15098,95	15098,95	RETRIBUZIONE PERSONALE SERVIZIO CULTURA EDUCAZIONE E SPORT - UFF. CULTURA, SPORT E GIOVANI: TRATTAMENTO ACCESSORIO - CONTO CONSUNTIVO 2015 RO 2016	2016	0	0	1	2016	9999	DD||K				D	N	0					SVI			2015	254			U.1.01.01.01.000	5	1		4	1103	1									30	1
110	I	2016	2016	716	0	N	N	950003	0	1	2016-01-01		N	8786,16	8786,16	RETRIBUZIONE PERSONALE SERVIZIO TRIBUTI: TRATTAMENTO ACCESSORIO - CONTO CONSUNTIVO 2015 RO 2016	2016	0	0	1	2016	9999	DD||K				D	N	0					SVI			2015	245			U.1.01.01.01.000	1	4		4	1103	1									30	1
111	I	2016	2016	717	0	N	N	215002	0	1	2016-01-01		N	996,28	996,28	vers. contr. cpdel e inadel p anno 2015 - CONTO CONSUNTIVO 2015 RO 2016	2016	0	0	1	2016	9999	DD||K				D	N	0					SVI			2015	264			U.1.01.02.01.000	1	3		4	1111	1									30	1
112	I	2016	2016	718	0	N	N	7988000	0	1	2016-01-01		N	55532,46	55532,46	PROGETTO INTEGRATO DI SVILUPPO URBANO DELLA CITTA' DI VC - PARTE - CONTO CONSUNTIVO 2015 IR-RO 2016	2016	0	0	1	2016	9999	DD||K				D	N	0					SVI			2015	1228			U.2.02.01.10.000	8	1		3	2116	1									30	1
113	I	2016	2016	719	0	N	N	2595004	0	1	2016-01-01		N	1550,87	1550,87	vers. irap anno 2015 - CONTO CONSUNTIVO 2015 RO 2016	2016	0	0	1	2016	9999	DD||K				D	N	0					SVI			2015	301			U.1.02.01.01.000	8	1		4	1701	1									30	1
114	I	2016	2016	720	0	N	N	5851000	0	1	2016-01-01		N	30000	30000	LAVORI RISANAMENTO CONSERVATIVO SCUOLA ELEM. GOZZANO ( V. CAP. 5850/3) - CONTO CONSUNTIVO 2015 IR-RO 2016	2016	0	0	1	2016	9999	DD||K				D	N	0					SVI			2015	731			U.2.02.01.09.000	4	2		4	2116	1									30	1
115	I	2016	2016	721	0	N	N	8508000	0	1	2016-01-01		N	500	500	LAVORI SEGNALETICA ORIZZONTALE E VERTICALE - CONTO CONSUNTIVO 2015 IR-RO 2016	2016	0	0	1	2016	9999	DD||K				D	N	0					SVI			2015	929			U.2.02.01.09.000	10	5		4	2102	1									30	1
116	I	2016	2016	722	0	N	N	2070002	0	1	2016-01-01		N	4308,01	4308,01	vers. contr. cpdel e inadel p anno 2015 - CONTO CONSUNTIVO 2015 RO 2016	2016	0	0	1	2016	9999	DD||K				D	N	0					SVI			2015	275			U.1.01.02.01.000	5	1		4	1111	1									30	1
117	I	2016	2016	723	0	N	N	3200004	0	1	2016-01-01		N	197,37	197,37	vers. irap anno 2015 - CONTO CONSUNTIVO 2015 RO 2016	2016	0	0	1	2016	9999	DD||K				D	N	0					SVI			2015	303			U.1.02.01.01.000	12	1		4	1701	1									30	1
118	I	2016	2016	724	0	N	N	420000	0	1	2016-01-01		N	2152,81	2152,81	ROSELLI AVV. C. - AFFID.TO INCARICO ATTIVAZIONE IN GIUDIZIO PER RILASCIO ALLOGGIO DI PROPRIETA' COM.LE IN VIA F.LLI GARRONE N. 12 - CONTO CONSUNTIVO 2015 RO 2016	2016	0	0	1	2016	9999	DD||K				D	N	0					SVI			2015	620			U.1.03.02.11.000	1	2		4	1331	1									30	1
119	I	2016	2016	725	0	N	N	420000	0	1	2016-01-01		N	3407,45	3407,45	LIONETTI AVV. D./MARCHIONI GEOM.A.- VERTENZA COMUNE VC/DITTA S.M. COSTRUZIONI SRL AVANTI AL TRIBUNALE DI VC - INTEGRAZIONE - CONTO CONSUNTIVO 2015 RO 2016	2016	0	0	1	2016	9999	DD||K				D	N	0					SVI			2015	660			U.1.03.02.11.000	1	2		4	1331	1									30	1
120	I	2016	2016	726	0	N	N	7344000	0	1	2016-01-01		N	9300	9300	MUTUO - CONTO CONSUNTIVO 2015 IR-RO 2016-MUTUO	2016	0	0	1	2016	9999	DD||K				D	N	0					SVI			2015	926			U.2.02.01.09.000	10	5		4	2102	1									30	1
121	I	2016	2016	727	0	N	N	8074001	0	1	2016-01-01		N	46764,44	46764,44	RESTAURO DEGLI APPARATI DECORATIVI DELLA EX CHIESA DI S. MARCO - CONTO CONSUNTIVO 2015 IR-RO 2016	2016	0	0	1	2016	9999	DD||K				D	N	0					SVI			2015	1249			U.2.02.01.10.000	1	5		4	2113	1									30	1
122	I	2016	2016	728	0	N	N	7988000	0	1	2016-01-01		N	672	672	PROGETTO INTEGRATO DI SVILUPPO URBANO DELLA CITTA' DI VC - PARTE - CONTO CONSUNTIVO 2015 IR-RO 2016	2016	0	0	1	2016	9999	DD||K				D	N	0					SVI			2015	1214			U.2.02.01.10.000	8	1		3	2116	1									30	1
123	I	2016	2016	729	0	N	N	7988000	0	1	2016-01-01		N	154928,94	154928,94	PROGETTO INTEGRATO DI SVILUPPO URBANO DELLA CITTA' DI VC - PARTE - CONTO CONSUNTIVO 2015 IR-RO 2016	2016	0	0	1	2016	9999	DD||K				D	N	0					SVI			2015	1214			U.2.02.01.10.000	8	1		3	2116	1									30	1
124	I	2016	2016	730	0	N	N	7548006	0	1	2016-01-01		N	75000	75000	NOVA VERDE SRL - PROROGA AFFID.TO SERV. MANUTENZ. E GESTIONE PATRIMONIO VEGETAZIONALE PER INTERVENTI DI MANUTENZ. STRAORD. VERDE PUBBLICO ANNO 2015 - PARTE - CONTO CONSUNTIVO 2015 RO 2016	2016	0	0	1	2016	9999	DD||K				D	N	0			E69E12000890004	3978488029	SVI			2015	1783			U.2.05.99.99.000	9	2		8	2101	1									30	1
125	I	2016	2016	731	0	N	N	7278004	0	1	2016-01-01		N	5628,74	5628,74	CAVALCAFERROVIA BELVEDERE - PRIMI INTERVENTI DI MESSA IN SICUREZZA  - CONTO CONSUNTIVO 2015 IR-RO 2016	2016	0	0	1	2016	9999	DD||K				D	N	0					SVI			2015	1120			U.2.02.01.09.000	10	5		4	2102	1									30	1
126	I	2016	2016	732	0	N	N	7344000	0	1	2016-01-01		N	7100,31	7100,31	MUTUO - CONTO CONSUNTIVO 2015 IR-RO 2016-MUTUO	2016	0	0	1	2016	9999	DD||K				D	N	0					SVI			2015	938			U.2.02.01.09.000	10	5		4	2102	1									30	1
127	I	2016	2016	733	0	N	N	8304001	0	1	2016-01-01		N	20330,52	20330,52	LAVORI DI MANUTENZIONE E PRONTO INTERVENTO RETE VIARIA CITTADINA ED AREE PUBBLICHE - CONTO CONSUNTIVO 2015 IR-RO 2016-MUTUO	2016	0	0	1	2016	9999	DD||K				D	N	0					SVI			2015	1030			U.2.02.01.09.000	10	5		4	2102	1									30	1
128	I	2016	2016	734	0	N	N	100002	0	1	2016-01-01		N	7109,38	7109,38	vers. contr. cpdel e inadel p anno 2015 - CONTO CONSUNTIVO 2015 RO 2016	2016	0	0	1	2016	9999	DD||K				D	N	0					SVI			2015	265			U.1.01.02.01.000	1	2		4	1111	1									30	1
129	I	2016	2016	735	0	N	N	7984001	0	1	2016-01-01		N	14,15	14,15	ACQUISTO TENSOSTRUTTURE PER IMPIANTI SPORTIVI -  - CONTO CONSUNTIVO 2015 IR-RO 2016	2016	0	0	1	2016	9999	DD||K				D	N	0					SVI			2015	1241			U.2.02.01.04.000	6	1		4	2502	1									30	1
130	I	2016	2016	736	0	N	N	7293000	0	1	2016-01-01		N	1298,63	1298,63	SISTEMAZIONE MARCIAPIEDI E VIABILITA' LOTTO 10 - CONTO CONSUNTIVO 2015 IR-RO 2016	2016	0	0	1	2016	9999	DD||K				D	N	0					SVI			2015	1018			U.2.02.01.09.000	10	5		4	2102	1									30	1
131	I	2016	2016	737	0	N	N	7300002	0	1	2016-01-01		N	10872,58	10872,58	RIQUALIFICAZ. CENTRO STORICO - VIA V. DEI CENTORI - GIOVENONE - E. DELLA MOTTA  - CONTO CONSUNTIVO 2015 IR-RO 2016	2016	0	0	1	2016	9999	DD||K				D	N	0					SVI			2015	998			U.2.02.01.09.000	10	5		4	2102	1									30	1
132	I	2016	2016	738	0	N	N	8508000	0	1	2016-01-01		N	150	150	LAVORI DI PRONTO INTERVENTO SEGNALETICA STRADALE ORIZZONTALE E VERTICALE - CONTO CONSUNTIVO 2015 IR-RO 2016	2016	0	0	1	2016	9999	DD||K				D	N	0					SVI			2015	943			U.2.02.01.09.000	10	5		4	2102	1									30	1
133	I	2016	2016	739	0	N	N	950002	0	1	2016-01-01		N	2260,37	2260,37	vers. contr. cpdel e inadel p anno 2015 - CONTO CONSUNTIVO 2015 RO 2016	2016	0	0	1	2016	9999	DD||K				D	N	0					SVI			2015	267			U.1.01.02.01.000	1	4		4	1111	1									30	1
134	I	2016	2016	740	0	N	N	214004	0	1	2016-01-01		N	786,68	786,68	vers. irap anno 2015 - CONTO CONSUNTIVO 2015 RO 2016	2016	0	0	1	2016	9999	DD||K				D	N	0					SVI			2015	289			U.1.02.01.01.000	1	3		4	1701	1									30	1
135	I	2016	2016	741	0	N	N	420000	0	1	2016-01-01		N	20000	20000	MANFERTO AVV. G.- AFFID.TO INCARICO VERTENZA COMUNE VC/OFFICINE CREDENDINO DI CREDENDINO M. E C. SNC AVANTI ALLA CORTEDI APPELLO DI TORINO - CONTO CONSUNTIVO 2015 RO 2016	2016	0	0	1	2016	9999	DD||K				D	N	0					SVI			2015	1576			U.1.03.02.11.000	1	2		4	1331	1									30	1
136	I	2016	2016	742	0	N	N	8508000	0	1	2016-01-01		N	300	300	LAVORI SEGNALETICA ORIZZONTALE E VERTICALE - CONTO CONSUNTIVO 2015 IR-RO 2016	2016	0	0	1	2016	9999	DD||K				D	N	0					SVI			2015	935			U.2.02.01.09.000	10	5		4	2102	1									30	1
137	I	2016	2016	743	0	N	N	8508000	0	1	2016-01-01		N	750	750	INTERVENTI DI MANUTENZ. E MODIFICA SEGNALETICA   - CONTO CONSUNTIVO 2015 IR-RO 2016	2016	0	0	1	2016	9999	DD||K				D	N	0					SVI			2015	950			U.2.02.01.09.000	10	5		4	2102	1									30	1
138	I	2016	2016	744	0	N	N	641002	0	1	2016-01-01		N	1307,98	1307,98	vers. contr. cpdel e inadel p anno 2015 - CONTO CONSUNTIVO 2015 RO 2016	2016	0	0	1	2016	9999	DD||K				D	N	0					SVI			2015	270			U.1.01.02.01.000	1	7		4	1111	1									30	1
139	I	2016	2016	745	0	N	N	641003	0	1	2016-01-01		N	5005,06	5005,06	RETRIBUZIONE PERSONALE DEL SERVIZIO SISTEMI INFORMATIVI E STATISTICA: TRATTAMENTO ACCESSORIO - CONTO CONSUNTIVO 2015 RO 2016	2016	0	0	1	2016	9999	DD||K				D	N	0					SVI			2015	248			U.1.01.01.01.000	1	7		4	1103	1									30	1
140	I	2016	2016	746	0	N	N	1341002	0	1	2016-01-01		N	747,08	747,08	vers. contr. cpdel e inadel p anno 2015 - CONTO CONSUNTIVO 2015 RO 2016	2016	0	0	1	2016	9999	DD||K				D	N	0					SVI			2015	273			U.1.01.02.01.000	3	1		4	1111	1									30	1
141	I	2016	2016	747	0	N	N	760001	0	1	2016-01-01		N	50	50	RETRIBUZIONE PERSONALE SERVIZIO GESTIONE PATRIMONIALE: ASSEGNI FISSI ED INDENNITA' - CONTO CONSUNTIVO 2015 RO 2016	2016	0	0	1	2016	9999	DD||K				D	N	0					SVI			2015	223			U.1.01.01.01.000	1	5		4	1101	1									30	1
142	I	2016	2016	748	0	N	N	643004	0	1	2016-01-01		N	1073,73	1073,73	vers. irap anno 2015 - CONTO CONSUNTIVO 2015 RO 2016	2016	0	0	1	2016	9999	DD||K				D	N	0					SVI			2015	294			U.1.02.01.01.000	1	7		4	1701	1									30	1
143	I	2016	2016	749	0	N	N	2070003	0	1	2016-01-01		N	9867,8	9867,8	RETRIBUZIONE PERSONALE SERVIZIO  BIBLIOTECHE ED ARCHIVIO STORICO: TRATTAMENTO ACCESSORIO - CONTO CONSUNTIVO 2015 RO 2016	2016	0	0	1	2016	9999	DD||K				D	N	0					SVI			2015	253			U.1.01.01.01.000	5	1		4	1103	1									30	1
144	I	2016	2016	750	0	N	N	3740004	0	1	2016-01-01		N	2806,6	2806,6	vers. irap anno 2015 - CONTO CONSUNTIVO 2015 RO 2016	2016	0	0	1	2016	9999	DD||K				D	N	0					SVI			2015	304			U.1.02.01.01.000	12	5		4	1701	1									30	1
145	I	2016	2016	751	0	N	N	3740003	0	1	2016-01-01		N	46536,19	46536,19	RETRIBUZIONE PERSONALE SETTORE POLITICHE SOCIALI: TRATTAMENTO ACCESSORIO - CONTO CONSUNTIVO 2015 RO 2016	2016	0	0	1	2016	9999	DD||K				D	N	0					SVI			2015	260			U.1.01.01.01.000	12	5		4	1103	1									30	1
146	I	2016	2016	752	0	N	N	2529000	0	1	2016-01-01		N	3257	3257	LESCA DOTT. GEOL. R. - AFFID.TO INCARICO PROGETTAZ. INTERVENTO FINALIZZATO ALLA CORREZ. ANSA INCIPIENTE IN SX IDROGRAFICA FIUME SESIA - CONTO CONSUNTIVO 2015 IR-RO 2016	2016	0	0	1	2016	9999	DD||K				D	N	0					SVI			2015	1333			U.1.03.02.11.000	8	1		4	1307	1									30	1
147	I	2016	2016	753	0	N	N	7961003	0	1	2016-01-01		N	6533,58	6533,58	INTERVENTI DI CONSOLIDAMENTO C/O SCUOLE MATERNE - MUTUO - CONTO CONSUNTIVO 2015 IR-RO 2016-MUTUO	2016	0	0	1	2016	9999	DD||K				D	N	0					SVI			2015	738			U.2.02.01.09.000	4	1		4	2109	1									30	1
148	I	2016	2016	754	0	N	N	500000	0	1	2016-01-01		N	3102,64	3102,64	A.N.C.I./A.I.C.C.R.E. - QUOTA ASSOCIATIVA ANNO 2015 - CONTO CONSUNTIVO 2015 RO 2016	2016	0	0	1	2016	9999	DD||K				D	N	0					SVI			2015	542			U.1.04.01.02.000	1	1		4	1569	1									30	1
149	I	2016	2016	755	0	N	N	8201000	0	1	2016-01-01		N	23483,38	23483,38	LAVORI REALIZZAZ. ROTATORIA TRA VIA T. DE REVEL E VIA DON POLLONE E RANGHINO - CONTO CONSUNTIVO 2015 IR-RO 2016-MUTUO	2016	0	0	1	2016	9999	DD||K				D	N	0					SVI			2015	1091			U.2.02.01.09.000	10	5		4	2102	1									30	1
150	I	2016	2016	756	0	N	N	8304001	0	1	2016-01-01		N	1359,22	1359,22	LAVORI DI PRONTO INTERVENTO SULLA RETE DI SMALTIMENTO DELLE ACQUE STRADALI - CONTO CONSUNTIVO 2015 IR-RO 2016-MUTUO	2016	0	0	1	2016	9999	DD||K				D	N	0					SVI			2015	1039			U.2.02.01.09.000	10	5		4	2102	1									30	1
151	I	2016	2016	757	0	N	N	8081000	0	1	2016-01-01		N	3216,92	3216,92	INTERVENTI OPERE DI RESTAURO CORRELATE AL SALONE DUGENTESCO - CONTO CONSUNTIVO 2015 IR-RO 2016	2016	0	0	1	2016	9999	DD||K				D	N	0					SVI			2015	1252			U.2.02.01.10.000	5	1		4	2113	1									30	1
152	I	2016	2016	758	0	N	N	8081002	0	1	2016-01-01		N	12750	12750	APPROVAZ. ATTI GARA PER AFFID.TO LAVORI P.I.S.U. EX OSPEDALE S. ANDREA INTERVENTO A.1-SALONE DUGENTESCO-RESTAURO AFFRESCHI, CORNICI E APPARATI LAPIDEI - PARTE  - CONTO CONSUNTIVO 2015 RO 2016	2016	0	0	1	2016	9999	DD||K				D	N	0			E62C15000080001	6374998888	SVI			2015	1696			U.2.02.01.10.000	5	1		6	2113	1									30	1
153	I	2016	2016	759	0	N	N	8081002	0	1	2016-01-01		N	8484,06	8484,06	APPROVAZ. ATTI GARA PER AFFID.TO LAVORI P.I.S.U. EX OSPEDALE S. ANDREA INTERVENTO A.1-SALONE DUGENTESCO-RESTAURO AFFRESCHI, CORNICI E APPARATI LAPIDEI - PARTE  - CONTO CONSUNTIVO 2015 RO 2016	2016	0	0	1	2016	9999	DD||K				D	N	0			E62C15000080001	6374998888	SVI			2015	1696			U.2.02.01.10.000	5	1		6	2113	1									30	1
154	I	2016	2016	760	0	N	N	8081002	0	1	2016-01-01		N	75,33	75,33	APPROVAZ. ATTI GARA PER AFFID.TO LAVORI P.I.S.U. EX OSPEDALE S. ANDREA INTERVENTO A.1-SALONE DUGENTESCO-RESTAURO AFFRESCHI, CORNICI E APPARATI LAPIDEI - PARTE  - CONTO CONSUNTIVO 2015 RO 2016	2016	0	0	1	2016	9999	DD||K				D	N	0			E62C15000080001	6374998888	SVI			2015	1696			U.2.02.01.10.000	5	1		6	2113	1									30	1
155	I	2016	2016	761	0	N	N	7988000	0	1	2016-01-01		N	409387,34	409387,34	PROGETTO INTEGRATO DI SVILUPPO URBANO DELLA CITTA' DI VC - PARTE - CONTO CONSUNTIVO 2015 IR-RO 2016	2016	0	0	1	2016	9999	DD||K				D	N	0					SVI			2015	1225			U.2.02.01.10.000	8	1		3	2116	1									30	1
156	I	2016	2016	762	0	N	N	7988000	0	1	2016-01-01		N	4051,19	4051,19	PROGETTO INTEGRATO DI SVILUPPO URBANO DELLA CITTA' DI VC - PARTE - CONTO CONSUNTIVO 2015 IR-RO 2016	2016	0	0	1	2016	9999	DD||K				D	N	0					SVI			2015	1225			U.2.02.01.10.000	8	1		3	2116	1									30	1
157	I	2016	2016	763	0	N	N	8055000	0	1	2016-01-01		N	127101	127101	INTERVENTI DI COMPENSAZIONE AMBIENTALE  - CONTO CONSUNTIVO 2015 IR-RO 2016	2016	0	0	1	2016	9999	DD||K				D	N	0					SVI			2015	1272			U.2.05.99.99.000	9	2		8	2108	1									30	1
158	I	2016	2016	764	0	N	N	7994000	0	1	2016-01-01		N	369,53	369,53	REALIZZAZ. SKATE PARK ALL'INTERNO DEL BOSCO DELLA CASCINA BARGE' - CONTO CONSUNTIVO 2015 IR-RO 2016	2016	0	0	1	2016	9999	DD||K				D	N	0					SVI			2015	1183			U.2.02.03.05.000	9	5		4	2601	1									30	1
159	I	2016	2016	765	0	N	N	8049001	0	1	2016-01-01		N	2290,29	2290,29	BONIFICA SITO VERCELLI ATENA N.728 STRADA PER ASIGLIANO - CONTO CONSUNTIVO 2015 IR-RO 2016	2016	0	0	1	2016	9999	DD||K				D	N	0					SVI			2015	1179			U.2.02.03.05.000	9	3		4	2601	1									30	1
160	I	2016	2016	766	0	N	N	8049001	0	1	2016-01-01		N	7070,27	7070,27	BONIFICA SITO VERCELLI ATENA N.728 STRADA PER ASIGLIANO - CONTO CONSUNTIVO 2015 IR-RO 2016	2016	0	0	1	2016	9999	DD||K				D	N	0					SVI			2015	1291			U.2.02.03.05.000	9	3		4	2601	1									30	1
161	I	2016	2016	767	0	N	N	7344000	0	1	2016-01-01		N	3814,62	3814,62	NUOVO COLLEGAMENTO TRA VIA CARDANO E VIALE TORRICELLI 1' LOTTO - CONTO CONSUNTIVO 2015 IR-RO 2016-MUTUO	2016	0	0	1	2016	9999	DD||K				D	N	0					SVI			2015	965			U.2.02.01.09.000	10	5		4	2102	1									30	1
162	I	2016	2016	768	0	N	N	6833000	0	1	2016-01-01		N	39434	39434	"PROGETTO ""HOME SWEET HOME"" ACQUISTO ARREDI - PARTE - CONTO CONSUNTIVO 2015 RO 2016"	2016	0	0	1	2016	9999	DD||K				D	N	0			F51E15000100001		SVI			2015	1902			U.2.02.01.03.000	12	5		8	2503	1									30	1
163	I	2016	2016	769	0	N	N	7995001	0	1	2016-01-01		N	32013,52	32013,52	REALIZZAZIONE CENTRO RACCOLTA DIFFERENZIATA - CONTO CONSUNTIVO 2015 IR-RO 2016-MUTUO	2016	0	0	1	2016	9999	DD||K				D	N	0					SVI			2015	1444			U.2.03.01.02.000	9	3		4	2769	1									30	1
164	I	2016	2016	770	0	N	N	8067000	0	1	2016-01-01		N	107910,1	107910,1	INTERVENTI SU STRUTTURE CON VINCOLO SOCIO ASSISTENZIALE  - CONTO CONSUNTIVO 2015 IR-RO 2016	2016	0	0	1	2016	9999	DD||K				D	N	0					SVI			2015	1452			U.2.02.01.09.000	12	5		4	2109	1									30	1
165	I	2016	2016	771	0	N	N	6970000	0	1	2016-01-01		N	95945,47	95945,47	SISTEMAZIONE A CIELO APERTO TORRENTE SESIETTA  - CONTO CONSUNTIVO 2015 IR-RO 2016	2016	0	0	1	2016	9999	DD||K				D	N	0					SVI			2015	1445			U.2.02.01.09.000	9	5		4	2103	1									30	1
166	I	2016	2016	772	0	N	N	6970000	0	1	2016-01-01		N	4054,53	4054,53	SISTEMAZIONE A CIELO APERTO TORRENTE SESIETTA  - CONTO CONSUNTIVO 2015 IR-RO 2016	2016	0	0	1	2016	9999	DD||K				D	N	0					SVI			2015	1445			U.2.02.01.09.000	9	5		4	2103	1									30	1
167	I	2016	2016	773	0	N	N	8508000	0	1	2016-01-01		N	123,72	123,72	LAVORI DI PRONTO INTERVENTO SEGNALETICA STRADALE ORIZZONTALE E VERTICALE - CONTO CONSUNTIVO 2015 IR-RO 2016	2016	0	0	1	2016	9999	DD||K				D	N	0					SVI			2015	940			U.2.02.01.09.000	10	5		4	2102	1									30	1
168	I	2016	2016	774	0	N	N	8508000	0	1	2016-01-01		N	49833,65	49833,65	LAVORI DI PRONTO INTERVENTO SEGNALETICA STRADALE ORIZZONTALE E VERTICALE - CONTO CONSUNTIVO 2015 IR-RO 2016	2016	0	0	1	2016	9999	DD||K				D	N	0					SVI			2015	948			U.2.02.01.09.000	10	5		4	2102	1									30	1
169	I	2016	2016	775	0	N	N	3490001	0	1	2016-01-01		N	1000	1000	RETRIBUZIONE PERSONALE ADDETTO AI CAMPI SPORTIVI: ASSEGNI FISSI ED INDENNITA' - CONTO CONSUNTIVO 2015 RO 2016	2016	0	0	1	2016	9999	DD||K				D	N	0					SVI			2015	232			U.1.01.01.01.000	6	1		4	1101	1									30	1
170	I	2016	2016	776	0	N	N	4200001	0	1	2016-01-01		N	2350	2350	RETRIBUZIONE PERSONALE MANUTENZIONE STRADE: ASSEGNI FISSI ED INDENNITA' - CONTO CONSUNTIVO 2015 RO 2016	2016	0	0	1	2016	9999	DD||K				D	N	0					SVI			2015	233			U.1.01.01.01.000	10	5		4	1101	1									30	1
171	I	2016	2016	777	0	N	N	2595003	0	1	2016-01-01		N	26333,38	26333,38	RETRIBUZIONE PERSONALE URBANISTICA ED EDILIZIA PRIVATA: TRATTAMENTO ACCESSORIO - CONTO CONSUNTIVO 2015 RO 2016	2016	0	0	1	2016	9999	DD||K				D	N	0					SVI			2015	257			U.1.01.01.01.000	8	1		4	1103	1									30	1
172	I	2016	2016	778	0	N	N	7970000	0	1	2016-01-01		N	395,43	395,43	MUTUO PER LAVORI DI MANUTENZ. COORD. EDIFICI PUBB. - ANNO 2011 - CONTO CONSUNTIVO 2015 IR-RO 2016-MUTUO	2016	0	0	1	2016	9999	DD||K				D	N	0					SVI			2015	782			U.2.02.02.01.000	1	5		4	2109	1									30	1
173	I	2016	2016	779	0	N	N	103004	0	1	2016-01-01		N	1148,57	1148,57	vers. irap anno 2015 - CONTO CONSUNTIVO 2015 RO 2016	2016	0	0	1	2016	9999	DD||K				D	N	0					SVI			2015	286			U.1.02.01.01.000	1	10		4	1701	1									30	1
174	I	2016	2016	780	0	N	N	7988000	0	1	2016-01-01		N	279,27	279,27	PROGETTO INTEGRATO DI SVILUPPO URBANO DELLA CITTA' DI VC - PARTE - CONTO CONSUNTIVO 2015 IR-RO 2016	2016	0	0	1	2016	9999	DD||K				D	N	0					SVI			2015	1226			U.2.02.01.10.000	8	1		3	2116	1									30	1
175	I	2016	2016	781	0	N	N	7634005	0	1	2016-01-01		N	177737,55	177737,55	LAVORI CONSOLIDAMENTO STRUTTURALE E RESTAURO CONSERVATIVO PALAZZO CENTORIS - CONTO CONSUNTIVO 2015 IR-RO 2016	2016	0	0	1	2016	9999	DD||K				D	N	0					SVI			2015	1341			U.2.02.01.10.000	1	5		4	2113	1									30	1
176	I	2016	2016	782	0	N	N	7634005	0	1	2016-01-01		N	2127,93	2127,93	LAVORI CONSOLIDAMENTO STRUTTURALE E RESTAURO CONSERVATIVO PALAZZO CENTORIS - CONTO CONSUNTIVO 2015 IR-RO 2016	2016	0	0	1	2016	9999	DD||K				D	N	0					SVI			2015	1341			U.2.02.01.10.000	1	5		4	2113	1									30	1
177	I	2016	2016	783	0	N	N	3102001	0	1	2016-01-01		N	330	330	RETRIBUZIONE AL PERSONALE SERVIZIO AMBIENTE E QUALITA' URBANA: ASSEGNI FISSI ED INDENNITA' - CONTO CONSUNTIVO 2015 RO 2016	2016	0	0	1	2016	9999	DD||K				D	N	0					SVI			2015	235			U.1.01.01.01.000	9	5		4	1101	1									30	1
178	I	2016	2016	784	0	N	N	6699005	0	1	2016-01-01		N	6200	6200	MUTUO PER INTERVENTI DIVERSI DI MANUTENZ. CIMITERI CITTADINI - ANNO 2011  - CONTO CONSUNTIVO 2015 IR-RO 2016-MUTUO	2016	0	0	1	2016	9999	DD||K				D	N	0					SVI			2015	795			U.2.02.01.09.000	12	9		4	2117	1									30	1
179	I	2016	2016	785	0	N	N	1341003	0	1	2016-01-01		N	2852,5	2852,5	RETRIBUZIONE AL PERSONALE POLIZIA MUNICIPALE - NUCLEO POLIZIA AMMINISTRATIVA: TRATTAMENTO ACCESSORIO - CONTO CONSUNTIVO 2015 RO 2016	2016	0	0	1	2016	9999	DD||K				D	N	0					SVI			2015	251			U.1.01.01.01.000	3	1		4	1103	1									30	1
180	I	2016	2016	786	0	N	N	1901001	0	1	2016-01-01		N	630	630	RETRIBUZIONE PERSONALE SERVIZIO CULTURA, EDUCAZIONE, SPORT - UFF. SCUOLA: ASSEGNI FISSI ED INDENNITA' - CONTO CONSUNTIVO 2015 RO 2016	2016	0	0	1	2016	9999	DD||K				D	N	0					SVI			2015	229			U.1.01.01.01.000	4	6		4	1101	1									30	1
181	I	2016	2016	787	0	N	N	8508000	0	1	2016-01-01		N	292,07	292,07	LAVORI SEGNALETICA ORIZZONTALE E VERTICALE - CONTO CONSUNTIVO 2015 IR-RO 2016	2016	0	0	1	2016	9999	DD||K				D	N	0					SVI			2015	927			U.2.02.01.09.000	10	5		4	2102	1									30	1
182	I	2016	2016	788	0	N	N	950004	0	1	2016-01-01		N	630,28	630,28	vers. irap anno 2015 -   CONTO CONSUNTIVO 2015 RO 2016	2016	0	0	1	2016	9999	DD||K				D	N	0					SVI			2015	290			U.1.02.01.01.000	1	4		4	1701	1									30	1
183	I	2016	2016	789	0	N	N	550002	0	1	2016-01-01		N	7213,27	7213,27	vers. contr. cpdel e inadel p anno 2015 - CONTO CONSUNTIVO 2015 RO 2016	2016	0	0	1	2016	9999	DD||K				D	N	0					SVI			2015	269			U.1.01.02.01.000	1	6		4	1111	1									30	1
